{
  "id": "ad_011",
  "advertiser": "Meesho",
  "platform": "YouTube",
  "format": "TVC",
  "duration_seconds": 30,
  "language": "Hindi",
  "url": "https://www.adgully.com/aise-kaise-meesho-s-mega-sale-with-kapil-sharma-and-tamannaah-bhatia-150203.html",
  "source": "web_search",
  "date_found": "2026-03-28",
  "date_published": "2024-09",
  "vertical": "E-commerce/value",
  "region": "India",
  "tier": null,
  "tier_notes": "",
  "description": "Mega Blockbuster Sale campaign with Kapil Sharma and Tamannaah Bhatia. Five ads set against festive backdrops showing families discovering unbelievable deals. Tagline Aise Kaise captures the surprise of finding great prices on ethnic fashion, kidswear, home items. Targets Tier 2-3 families shopping on a budget.",
  "why_included": "Meesho is THE lower-middle-class brand in India. Their ads specifically target families of 4-5 in Tier 2-3 cities — exactly Wiom's audience. Celebrity plus value-messaging plus festive context is a proven formula for this segment. 100 percent Day 1 order increase proves it worked.",
  "tags": [
    "family",
    "value-messaging",
    "celebrity",
    "festive",
    "tier-2-3",
    "lower-middle-class",
    "budget-conscious"
  ],
  "deconstructed": true
}