{
  "id": "ad_012",
  "advertiser": "Surf Excel",
  "platform": "YouTube",
  "format": "TVC",
  "duration_seconds": 45,
  "language": "Hindi",
  "url": "https://www.campaignindia.in/article/surf-excel-urges-consumers-to-celebrate-stains/410607",
  "source": "web_search",
  "date_found": "2026-03-28",
  "date_published": "2024-01",
  "vertical": "FMCG/household",
  "region": "India",
  "tier": null,
  "tier_notes": "",
  "description": "Daag Acche Hain evolution. Kids getting messy while doing something kind or brave, with parents initially worried about stains then realizing the stain tells a story of good values. Transforms a mundane product into an emotional story about parenting and childhood. Multi-generational Indian advertising icon.",
  "why_included": "The blueprint for family-targeted advertising in India. Shows kids plus parents in authentic middle-class homes. Turns a commodity product into an emotional choice. Wiom faces the same commodity challenge with broadband. If Surf Excel can make detergent emotional, Wiom can make internet emotional.",
  "tags": [
    "family",
    "kids",
    "emotional",
    "middle-class",
    "parenting",
    "commodity-to-emotion",
    "iconic"
  ],
  "deconstructed": true
}