{
  "id": "ad_013",
  "advertiser": "Tata Tea",
  "platform": "YouTube",
  "format": "TVC",
  "duration_seconds": 60,
  "language": "Hindi",
  "url": "https://beastoftraal.com/2025/01/06/the-10-best-indian-ads-of-2024/",
  "source": "web_search",
  "date_found": "2026-03-28",
  "date_published": "2024-01",
  "vertical": "FMCG/beverage",
  "region": "India",
  "tier": null,
  "tier_notes": "",
  "description": "Jaago Re 2024 campaign addressing generational differences in how Indians perceive patriotism. Heartfelt conversations between parents and kids in a middle-class living room. The family debates what loving your country means today versus 30 years ago. Sparked widespread social media debate.",
  "why_included": "Middle-class living room as the stage. Parent-child generational tension as the hook. This is the exact household Wiom targets: family of 4-5 sitting together, different generations with different worldviews, united by shared moments at home. The debate format drives massive shareability.",
  "tags": [
    "family",
    "generational",
    "living-room",
    "debate",
    "shareability",
    "middle-class",
    "social-commentary"
  ],
  "deconstructed": true
}