{
  "id": "ad_009",
  "advertiser": "Sony LIV",
  "platform": "YouTube",
  "format": "In-Feed Video",
  "duration_seconds": 45,
  "language": "Hindi",
  "url": "https://beastoftraal.com/2026/01/05/the-10-best-indian-ads-of-2025/#sonyliv",
  "source": "web_search",
  "date_found": "2026-03-28",
  "date_published": "2025-04",
  "vertical": "OTT/entertainment",
  "region": "India",
  "tier": null,
  "tier_notes": "",
  "description": "Shark Tank India S5 registration ad titled Do Not Apply. Satirical reverse-psychology approach discouraging applications to actually drive sign-ups. References employment debates. Top 10 Indian ad of 2025.",
  "why_included": "Reverse psychology as hook. Telling people NOT to do something makes them want to do it. Bold creative choice. Could Wiom say Do Not Switch to test this pattern?",
  "tags": [
    "reverse-psychology",
    "satire",
    "bold-hook",
    "OTT",
    "curiosity-gap"
  ],
  "deconstructed": true
}