{
  "id": "ad_007",
  "advertiser": "Cadbury Dairy Milk",
  "platform": "YouTube",
  "format": "TVC",
  "duration_seconds": 60,
  "language": "Hindi",
  "url": "https://beastoftraal.com/2026/01/05/the-10-best-indian-ads-of-2025/#cadbury",
  "source": "web_search",
  "date_found": "2026-03-28",
  "date_published": "2025-02",
  "vertical": "FMCG",
  "region": "India",
  "tier": null,
  "tier_notes": "",
  "description": "New Neighbour campaign. Narrative about inclusivity and language: a woman considers how to retell a story to accommodate a non-local language speaker. Emotional storytelling with a twist. Top 10 Indian ad of 2025.",
  "why_included": "Cadbury is gold standard of Indian emotional advertising. Language and inclusion theme directly relevant to Wiom in multi-lingual India. Masterclass in earned emotional payoff.",
  "tags": [
    "emotional",
    "inclusivity",
    "language",
    "narrative-twist",
    "warmth",
    "FMCG"
  ],
  "deconstructed": true
}