{
  "id": "ad_002",
  "advertiser": "Lahori Zeera",
  "platform": "YouTube",
  "format": "In-Feed Video",
  "duration_seconds": 30,
  "language": "Hindi",
  "url": "https://www.linkedin.com/posts/karts_advertising-marketing-creative-activity-7192757402830540800-pZfy",
  "source": "web_search",
  "date_found": "2026-03-28",
  "date_published": "2024-05",
  "vertical": "D2C/beverage",
  "region": "India",
  "tier": null,
  "tier_notes": "",
  "description": "Exaggerated scenarios of people consuming the beverage while performing extreme activities like running, wrestling, swimming. Over-the-top humor with fast cuts. Named among top 10 Indian ads of 2024.",
  "why_included": "Masterclass in exaggeration-as-hook. High-energy pacing and humor that cuts through clutter. Pattern worth studying: can exaggeration work for broadband speed/reliability?",
  "tags": [
    "humor",
    "exaggeration",
    "fast-paced",
    "D2C",
    "high-energy"
  ],
  "deconstructed": true
}